<?xml version="1.0" encoding="ISO-8859-1"?>
<types xmlns:xsi="http://www.w3.org/2001/XMLSchema-instance"
	xsi:noNamespaceSchemaLocation="itemtypes.xsd">

	<type name="Product" typeCode="Product" package="at.spot.commerce.catalog">
		<description>The base type Product is used for all purchasable items.</description>
		<properties>
			<property name="code">
				<datatype class="java.lang.String" />
				<description>The unique product code.</description>
				<modifiers unique="true" />
				<validators>
					<validator javaClass="javax.validation.constraints.NotNull" />
				</validators>
			</property>
		</properties>
	</type>
</types>