<?xml version="1.0" encoding="ISO-8859-1"?>
<types xmlns:xsi="http://www.w3.org/2001/XMLSchema-instance"
	xsi:noNamespaceSchemaLocation="http://spot-next.io/schemas/v1/itemtypes.xsd">

	<!-- enums -->

	<enum name="UserType" package="io.spotnext.sample.types.enumerations">
		<value code="GUEST" />
		<value code="REGISTERED" />
	</enum>

	<bean name="UserData" package="io.spotnext.sample.types.beans">
		<properties>
			<property name="type" type="UserType">
				<validators>
					<validator javaClass="javax.validation.constraints.NotNull" />
				</validators>
			</property>
		</properties>
	</bean>

	<!-- users and groups -->

	<type name="User" package="io.spotnext.itemtype.core.user">
		<properties>
			<property name="type" type="UserType">
				<validators>
					<validator javaClass="javax.validation.constraints.NotNull" />
				</validators>
				<defaultValue>io.spotnext.sample.types.enumerations.UserType.REGISTERED
				</defaultValue>
			</property>
		</properties>
	</type>
	
	<type name="Party" package="io.spotnext.sample.types.itemtypes">
		<properties>
			<property name="title" type="String">
				<description>The unique title of the party</description>
				<modifiers unique="true" />
				<validators>
					<validator javaClass="javax.validation.constraints.NotNull" />
				</validators>
			</property>
			<property name="motto" type="LocalizedString" localized="true">
				<description>The localized motto of the party</description>
			</property>
			<property name="location" type="Address">
				<description>The location the party will take place</description>
			</property>
			<property name="date" type="Date">
				<description>The date the party will take place</description>
			</property>
			<property name="fixed" type="boolean">
				<description>Defines that the party has been fixed and should not be changed anymore.</description>
				<defaultValue>false</defaultValue>
			</property>
		</properties>
	</type>

	<relation name="Party2InvitedUser">
		<source itemType="Party" mappedBy="parties" cardinality="many">
			<description>The parties this user is invited.</description>
		</source>
		<target itemType="User" mappedBy="invitedGuests" cardinality="many">
			<description>The guests that are invited to this party.</description>
		</target>
	</relation>

</types>

